,PaperName,Year,sources,place,authors,hyperlink,citationG,citationO,citationI
0,A DSM-based Polar Transmitter with 23.8% System Efficiency.,2021,ACM, Taiwan,"Yuncheng Zhang, Bangan Liu, Xiaofan Gu, Chun Wang, Atsushi Shirane, Kenichi Okada",https://doi.org/10.1145/3394885.3431653,0,0,0
1,A 0.41W 34Gb/s 300GHz CMOS Wireless Transceiver.,2021,ACM, Taiwan,"Ibrahim Abdo, Takuya Fujimura, Tsuyoshi Miura, Korkut Kaan Tokgoz, Atsushi Shirane, Kenichi Okada",https://doi.org/10.1145/3394885.3431645,4,0,0
2,Capacitive Sensor Circuit with Relative Slope-Boost Method Based on a Relaxation Oscillator.,2021,ACM, Taiwan,"Ryo Onishi, Koki Miyamoto, Korkut Kaan Tokgoz, Noboru Ishihara, Hiroyuki Ito",https://doi.org/10.1145/3394885.3431655,0,0,0
3,28GHz Phase Shifter with Temperature Compensation for 5G NR Phased-array Transceiver.,2021,ACM, Taiwan,"Yi Zhang, Jian Pang, Kiyoshi Yanagizawa, Atsushi Shirane, Kenichi Okada",https://doi.org/10.1145/3394885.3431650,2,0,0
4,An up to 35 dBc/Hz Phase Noise Improving Design Methodology for Differential-Ring-Oscillators Applied in Ultra-Low Power Systems.,2021,ACM, Taiwan,"Peter Toth, Hiroki Ishikuro",https://doi.org/10.1145/3394885.3431644,0,0,0
5,Gate Voltage Optimization in Capacitive DC-DC Converters for Thermoelectric Energy Harvesting.,2021,ACM, Taiwan,"Yi Tan, Yohsuke Shiiki, Hiroki Ishikuro",https://doi.org/10.1145/3394885.3431654,0,0,0
6,A 0.57-GOPS/DSP Object Detection PIM Accelerator on FPGA.,2021,ACM, Taiwan,"Bo Jiao, Jinshan Zhang, Yuanyuan Xie, Shunli Wang, Haozhe Zhu, Xiaoyang Kang, Zhiyan Dong, Lihua Zhang, Chixiao Chen",https://doi.org/10.1145/3394885.3431659,5,2,0
7,Supply Noise Reduction Filter for Parallel Integrated Transimpedance Amplifiers.,2021,ACM, Taiwan,"Shinya Tanimura, Akira Tsuchiya, Toshiyuki Inoue, Keiji Kishine",https://doi.org/10.1145/3394885.3431646,0,0,0
8,A Fast Yet Accurate Message-level Communication Bus Model for Timing Prediction of SDFGs on MPSoC.,2021,ACM, Taiwan,"Hai-Dang Vu, Sebastien Le Nours, Sébastien Pillement, Ralf Stemmer, Kim Grüttner",https://doi.org/10.1145/3394885.3431418,3,1,0
9,Simulation of Ideally Switched Circuits in SystemC.,2021,ACM, Taiwan,"Breytner Joseph Fernández-Mesa, Liliana Andrade, Frédéric Pétrot",https://doi.org/10.1145/3394885.3431417,0,0,0
10,HW-BCP: A Custom Hardware Accelerator for SAT Suitable for Single Chip Implementation for Large Benchmarks.,2021,ACM, Taiwan,"Soowang Park, Jae-Won Nam, Sandeep K. Gupta",https://doi.org/10.1145/3394885.3431413,0,0,0
11,A Novel DRAM-Based Process-in-Memory Architecture and its Implementation for CNNs.,2021,ACM, Taiwan,"Chirag Sudarshan, Taha Soliman, Cecilia De la Parra, Christian Weis, Leonardo Ecco, Matthias Jung, Norbert Wehn, Andre Guntoro",https://doi.org/10.1145/3394885.3431522,8,6,0
12,A Quantized Training Framework for Robust and Accurate ReRAM-based Neural Network Accelerators.,2021,ACM, Taiwan,"Chenguang Zhang, Pingqiang Zhou",https://doi.org/10.1145/3394885.3431528,6,1,0
13,Attention-in-Memory for Few-Shot Learning with Configurable Ferroelectric FET Arrays.,2021,ACM, Taiwan,"Dayane Reis, Ann Franchesca Laguna, Michael T. Niemier, Xiaobo Sharon Hu",https://doi.org/10.1145/3394885.3431526,6,1,0
14,Mutation-based Compliance Testing for RISC-V.,2021,ACM, Taiwan,"Vladimir Herdt, Sören Tempel, Daniel Große, Rolf Drechsler",https://doi.org/10.1145/3394885.3431584,5,1,0
15,A General Equivalence Checking Framework for Multivalued Logic.,2021,ACM, Taiwan,"Chia-Chun Lin, Hsin-Ping Yen, Sheng-Hsiu Wei, Pei-Pei Chen, Yung-Chih Chen, Chun-Yao Wang",https://doi.org/10.1145/3394885.3431588,1,1,0
16,ATLaS: Automatic Detection of Timing-based Information Leakage Flows for SystemC HLS Designs.,2021,ACM, Taiwan,"Mehran Goli, Rolf Drechsler",https://doi.org/10.1145/3394885.3431591,5,0,0
17,A Multi-Commodity Network Flow Based Routing Algorithm for Paper-Based Digital Microfluidic Biochips.,2021,ACM, Taiwan,"Nai-Ren Shih, Tsung-Yi Ho",https://doi.org/10.1145/3394885.3431611,0,0,0
18,Interference-Free Design Methodology for Paper-Based Digital Microfluidic Biochips.,2021,ACM, Taiwan,"Yun-Chen Lo, Bing Li, Sooyong Park, Kwanwoo Shin, Tsung-Yi Ho",https://doi.org/10.1145/3394885.3431609,1,0,0
19,Accurate and Efficient Simulation of Microfluidic Networks.,2021,ACM, Taiwan,"Gerold Fink, Philipp Ebner, Medina Hamidovic, Werner Haselmayr, Robert Wille",https://doi.org/10.1145/3394885.3431608,4,2,0
20,A 65nm CMOS Process Li-ion Battery Charging Cascode SIDO Boost Converter with 89% Maximum Efficiency for RF Wireless Power Transfer Receiver.,2021,ACM, Taiwan,"Yasuaki Isshiki, Dai Suzuki, Ryo Ishida, Kousuke Miyaji",https://doi.org/10.1145/3394885.3431647,1,0,0
21,A High Accuracy Phase and Amplitude Detection Circuit for Calibration of 28GHz Phased Array Beamformer System.,2021,ACM, Taiwan,"Joshua Alvin, Jian Pang, Atsushi Shirane, Kenichi Okada",https://doi.org/10.1145/3394885.3431648,0,0,0
22,"A Highly Integrated Energy-efficient CMOS Millimeter-wave Transceiver with Direct-modulation Digital Transmitter, Quadrature Phased-coupled Frequency Synthesizer and Substrate-Integrated Waveguide E-shaped Patch Antenna.",2021,ACM, Taiwan,"Wei Deng, Zheng Song, Ruichang Ma, Haikun Jia, Baoyong Chi",https://doi.org/10.1145/3394885.3431652,0,0,0
23,A 3D-Stacked SRAM Using Inductive Coupling Technology for AI Inference Accelerator in 40-nm CMOS.,2021,ACM, Taiwan,"Kota Shiba, Tatsuo Omori, Mototsugu Hamada, Tadahiro Kuroda",https://doi.org/10.1145/3394885.3431642,2,0,0
24,Sub-10-μm Coil Design for Multi-Hop Inductive Coupling Interface.,2021,ACM, Taiwan,"Tatsuo Omori, Kota Shiba, Mototsugu Hamada, Tadahiro Kuroda",https://doi.org/10.1145/3394885.3431649,0,0,0
25,Current-Starved Chaotic Oscillator Over Multiple Frequency Decades on Low-Cost CMOS: Towards Distributed and Scalable Environmental Sensing with a Myriad of Nodes.,2021,ACM, Taiwan,"Korkut Kaan Tokgoz, Ludovico Minati, Hiroyuki Ito",https://doi.org/10.1145/3394885.3431651,0,0,0
26,TCI Tester: Tester for Through Chip Interface.,2021,ACM, Taiwan,"Hideto Kayashima, Hideharu Amano",https://doi.org/10.1145/3394885.3431660,0,0,0
27,An 18 Bit Time-to-Digital Converter Design with Large Dynamic Range and Automated Multi-Cycle Concept.,2021,ACM, Taiwan,"Peter Toth, Hiroki Ishikuro",https://doi.org/10.1145/3394885.3431643,1,1,0
28,Connection-based Processing-In-Memory Engine Design Based on Resistive Crossbars.,2021,ACM, Taiwan,"Shuhang Zhang, Hai Helen Li, Ulf Schlichtmann",https://doi.org/10.1145/3394885.3431523,1,0,0
29,FePIM: Contention-Free In-Memory Computing Based on Ferroelectric Field-Effect Transistors.,2021,ACM, Taiwan,"Xiaoming Chen, Yuping Wu, Yinhe Han",https://doi.org/10.1145/3394885.3431530,2,0,0
30,RIME: A Scalable and Energy-Efficient Processing-In-Memory Architecture for Floating-Point Operations.,2021,ACM, Taiwan,"Zhaojun Lu, Md Tanvir Arafin, Gang Qu",https://doi.org/10.1145/3394885.3431524,8,0,0
31,A Non-Volatile Computing-In-Memory Framework With Margin Enhancement Based CSA and Offset Reduction Based ADC.,2021,ACM, Taiwan,"Yuxuan Huang, Yifan He, Jinshan Yue, Huazhong Yang, Yongpan Liu",https://doi.org/10.1145/3394885.3431521,1,0,0
32,"Cross-layer Design for Computing-in-Memory: From Devices, Circuits, to Architectures and Applications.",2021,ACM, Taiwan,"Hussam Amrouch, Xiaobo Sharon Hu, Mohsen Imani, Ann Franchesca Laguna, Michael T. Niemier, Simon Thomann, Xunzhao Yin, Cheng Zhuo",https://doi.org/10.1145/3394885.3431617,1,0,0
33,Automatic Surrogate Model Generation and Debugging of Analog/Mixed-Signal Designs Via Collaborative Stimulus Generation and Machine Learning.,2021,ACM, Taiwan,"Jun-Yang Lei, Abhijit Chatterjee",https://doi.org/10.1145/3394885.3431544,1,1,0
34,A Robust Batch Bayesian Optimization for Analog Circuit Synthesis via Local Penalization.,2021,ACM, Taiwan,"Jiangli Huang, Fan Yang, Changhao Yan, Dian Zhou, Xuan Zeng",https://doi.org/10.1145/3394885.3431543,1,1,0
35,Layout Symmetry Annotation for Analog Circuits with Graph Neural Networks.,2021,ACM, Taiwan,"Xiaohan Gao, Chenhui Deng, Mingjie Liu, Zhiru Zhang, David Z. Pan, Yibo Lin",https://doi.org/10.1145/3394885.3431545,13,7,0
36,Fast and Efficient Constraint Evaluation of Analog Layout Using Machine Learning Models.,2021,ACM, Taiwan,"Tonmoy Dhar, Jitesh Poojary, Yaguang Li, Kishor Kunal, Meghna Madhusudan, Arvind K. Sharma, Susmita Dey Manasi, Jiang Hu, Ramesh Harjani, Sachin S. Sapatnekar",https://doi.org/10.1145/3394885.3431547,3,0,0
37,TreeNet: Deep Point Cloud Embedding for Routing Tree Construction.,2021,ACM, Taiwan,"Wei Li, Yuxiao Qu, Gengjie Chen, Yuzhe Ma, Bei Yu",https://doi.org/10.1145/3394885.3431566,4,0,0
38,A Unified Printed Circuit Board Routing Algorithm With Complicated Constraints and Differential Pairs.,2021,ACM, Taiwan,"Ting-Chou Lin, Devon J. Merrill, Yen-Yi Wu, Chester Holtz, Chung-Kuan Cheng",https://doi.org/10.1145/3394885.3431568,3,0,0
39,Multi-FPGA Co-optimization: Hybrid Routing and Competitive-based Time Division Multiplexing Assignment.,2021,ACM, Taiwan,"Dan Zheng, Xiaopeng Zhang, Chak-Wa Pui, Evangeline F. Y. Young",https://doi.org/10.1145/3394885.3431565,1,0,0
40,Boosting Pin Accessibility Through Cell Layout Topology Diversification.,2021,ACM, Taiwan,"Suwan Kim, Kyeongrok Jo, Taewhan Kim",https://doi.org/10.1145/3394885.3431567,6,2,0
41,"Approximate Computing for ML: State-of-the-art, Challenges and Visions.",2021,ACM, Taiwan,"Georgios Zervakis, Hassaan Saadat, Hussam Amrouch, Andreas Gerstlauer, Sri Parameswaran, Jörg Henkel",https://doi.org/10.1145/3394885.3431632,15,0,0
42,Bridging the Frequency Gap in Heterogeneous 3D SoCs through Technology-Specific NoC Router Architectures.,2021,ACM, Taiwan,"Jan Moritz Joseph, Lennart Bamberg, Geonhwa Jeong, Ruei-Ting Chien, Rainer Leupers, Alberto García-Ortiz, Tushar Krishna, Thilo Pionteck",https://doi.org/10.1145/3394885.3431421,1,1,0
43,Combining Memory Partitioning and Subtask Generation for Parallel Data Access on CGRAs.,2021,ACM, Taiwan,"Cheng Li, Jiangyuan Gu, Shouyi Yin, Leibo Liu, Shaojun Wei",https://doi.org/10.1145/3394885.3431414,1,0,0
44,A Dynamic Link-latency Aware Cache Replacement Policy (DLRP).,2021,ACM, Taiwan,"Yen-Hao Chen, Allen C.-H. Wu, TingTing Hwang",https://doi.org/10.1145/3394885.3431420,1,0,0
45,Prediction of Register Instance Usage and Time-sharing Register for Extended Register Reuse Scheme.,2021,ACM, Taiwan,"Shuxin Zhou, Huandong Wang, Dong Tong",https://doi.org/10.1145/3394885.3431412,0,0,0
46,Residue-Net: Multiplication-free Neural Network by In-situ No-loss Migration to Residue Number Systems.,2021,ACM, Taiwan,"Sahand Salamat, Sumiran Shubhi, Behnam Khaleghi, Tajana Rosing",https://doi.org/10.1145/3394885.3431541,2,0,0
47,A Multiple-Precision Multiply and Accumulation Design with Multiply-Add Merged Strategy for AI Accelerating.,2021,ACM, Taiwan,"Song Zhang, Jiangyuan Gu, Shouyi Yin, Leibo Liu, Shaojun Wei",https://doi.org/10.1145/3394885.3431531,1,1,0
48,DeepOpt: Optimized Scheduling of CNN Workloads for ASIC-based Systolic Deep Learning Accelerators.,2021,ACM, Taiwan,"Susmita Dey Manasi, Sachin S. Sapatnekar",https://doi.org/10.1145/3394885.3431539,8,0,0
49,"Value-Aware Error Detection and Correction for SRAM Buffers in Low-Bitwidth, Floating-Point CNN Accelerators.",2021,ACM, Taiwan,"Jun-Shen Wu, Chi-En Wang, Ren-Shuo Liu",https://doi.org/10.1145/3394885.3431540,0,0,0
50,MIPAC: Dynamic Input-Aware Accuracy Control for Dynamic Auto-Tuning of Iterative Approximate Computing.,2021,ACM, Taiwan,"Taylor Kemp, Yao Yao, Younghyun Kim",https://doi.org/10.1145/3394885.3431551,3,0,0
51,Normalized Stability: A Cross-Level Design Metric for Early Termination in Stochastic Computing.,2021,ACM, Taiwan,"Di Wu, Ruokai Yin, Joshua San Miguel",https://doi.org/10.1145/3394885.3431549,4,0,0
52,Zero Correlation Error: A Metric for Finite-Length Bitstream Independence in Stochastic Computing.,2021,ACM, Taiwan,"Hsuan Hsiao, Joshua San Miguel, Yuko Hara-Azumi, Jason Helge Anderson",https://doi.org/10.1145/3394885.3431552,4,0,0
53,An Efficient Approximate Node Merging with an Error Rate Guarantee.,2021,ACM, Taiwan,"Kit Seng Tam, Chia-Chun Lin, Yung-Chih Chen, Chun-Yao Wang",https://doi.org/10.1145/3394885.3431550,1,0,0
54,An Adaptive Delay Model for Timing Yield Estimation under Wide-Voltage Range.,2021,ACM, Taiwan,"Hao Yan, Xiao Shi, Chengzhen Xuan, Peng Cao, Longxing Shi",https://doi.org/10.1145/3394885.3431581,0,0,0
55,ATM: A High Accuracy Extracted Timing Model for Hierarchical Timing Analysis.,2021,ACM, Taiwan,"Kuan-Ming Lai, Tsung-Wei Huang, Pei-Yu Lee, Tsung-Yi Ho",https://doi.org/10.1145/3394885.3431578,1,0,0
56,Mode-wise Voltage-scalable Design with Activation-aware Slack Assignment for Energy Minimization.,2021,ACM, Taiwan,"TaiYu Cheng, Yukata Masuda, Jun Nagayama, Yoichi Momiyama, Jun Chen, Masanori Hashimoto",https://doi.org/10.1145/3394885.3431575,1,0,0
57,A Timing Prediction Framework for Wide Voltage Design with Data Augmentation Strategy.,2021,ACM, Taiwan,"Peng Cao, Wei Bao, Kai Wang, Tai Yang",https://doi.org/10.1145/3394885.3431582,1,1,0
58,Energy-Efficient Deep Neural Networks with Mixed-Signal Neurons and Dense-Local and Sparse-Global Connectivity.,2021,ACM, Taiwan,"Baibhab Chatterjee, Shreyas Sen",https://doi.org/10.1145/3394885.3431614,1,0,0
59,Merged Logic and Memory Fabrics for AI Workloads.,2021,ACM, Taiwan,"Brian Crafton, Samuel Spetalnick, Arijit Raychowdhury",https://doi.org/10.1145/3394885.3431615,0,0,0
60,Vision Control Unit in Fully Self Driving Vehicles using Xilinx MPSoC and Opensource Stack.,2021,ACM, Taiwan,"Ravikumar V. Chakaravarthy, Hyun Kwon, Hua Jiang",https://doi.org/10.1145/3394885.3431616,1,0,0
61,Constrained Conservative State Symbolic Co-analysis for Ultra-low-power Embedded Systems.,2021,ACM, Taiwan,"Shashank Hegde, Subhash Sethumurugan, Hari Cherupalli, Henry Duwe, John Sartori",https://doi.org/10.1145/3394885.3431157,1,0,0
62,Arbitrary and Variable Precision Floating-Point Arithmetic Support in Dynamic Binary Translation.,2021,ACM, Taiwan,"Marie Badaroux, Frédéric Pétrot",https://doi.org/10.1145/3394885.3431416,1,0,0
63,Optimizing Temporal Decoupling using Event Relevance.,2021,ACM, Taiwan,"Lukas Jünger, Carmine Bianco, Kristof Niederholtmeyer, Dietmar Petras, Rainer Leupers",https://doi.org/10.1145/3394885.3431419,1,0,0
64,Design Space Exploration of Heterogeneous-Accelerator SoCs with Hyperparameter Optimization.,2021,ACM, Taiwan,"Thanh Cong, François Charot",https://doi.org/10.1145/3394885.3431415,1,0,0
65,DNR: A Tunable Robust Pruning Framework Through Dynamic Network Rewiring of DNNs.,2021,ACM, Taiwan,"Souvik Kundu, Mahdi Nazemi, Peter A. Beerel, Massoud Pedram",https://doi.org/10.1145/3394885.3431542,24,0,0
66,Dynamic Programming Assisted Quantization Approaches for Compressing Normal and Robust DNN Models.,2021,ACM, Taiwan,"Dingcheng Yang, Wenjian Yu, Haoyuan Mu, Gary Yao",https://doi.org/10.1145/3394885.3431538,4,2,0
67,Accelerate Non-unit Stride Convolutions with Winograd Algorithms.,2021,ACM, Taiwan,"Junhao Pan, Deming Chen",https://doi.org/10.1145/3394885.3431534,10,1,0
68,Efficient Accuracy Recovery in Approximate Neural Networks by Systematic Error Modelling.,2021,ACM, Taiwan,"Cecilia De la Parra, Andre Guntoro, Akash Kumar",https://doi.org/10.1145/3394885.3431533,2,0,0
69,Mixed Precision Quantization for ReRAM-based DNN Inference Accelerators.,2021,ACM, Taiwan,"Sitao Huang, Aayush Ankit, Plínio Silveira, Rodrigo Antunes, Sai Rahul Chalamalasetti, Izzat El Hajj, Dong Eun Kim, Glaucimar Aguiar, Pedro Bruel, Sergey Serebryakov, Cong Xu, Can Li, Paolo Faraboschi, John Paul Strachan, Deming Chen, Kaushik Roy, Wen-Mei W. Hwu, Dejan S. Milojicic",https://doi.org/10.1145/3394885.3431554,20,4,0
70,A reduced-precision streaming SpMV architecture for Personalized PageRank on FPGA.,2021,ACM, Taiwan,"Alberto Parravicini, Francesco Sgherzi, Marco D. Santambrogio",https://doi.org/10.1145/3394885.3431548,10,5,0
71,HyperRec: Efficient Recommender Systems with Hyperdimensional Computing.,2021,ACM, Taiwan,"Yunhui Guo, Mohsen Imani, Jaeyoung Kang, Sahand Salamat, Justin Morris, Baris Aksanli, Yeseong Kim, Tajana Rosing",https://doi.org/10.1145/3394885.3431553,6,0,0
72,"Efficient Techniques for Training the Memristor-based Spiking Neural Networks Targeting Better Speed, Energy and Lifetime.",2021,ACM, Taiwan,"Yu Ma, Pingqiang Zhou",https://doi.org/10.1145/3394885.3431555,3,0,0
73,PCBench: Benchmarking of Board-Level Hardware Attacks and Trojans.,2021,ACM, Taiwan,"Huifeng Zhu, Xiaolong Guo, Yier Jin, Xuan Zhang",https://doi.org/10.1145/3394885.3431596,6,0,0
74,Cache-Aware Dynamic Skewed Tree for Fast Memory Authentication.,2021,ACM, Taiwan,"Saru Vig, Siew-Kei Lam, Rohan Juneja",https://doi.org/10.1145/3394885.3431593,2,2,0
75,Automated Test Generation for Hardware Trojan Detection using Reinforcement Learning.,2021,ACM, Taiwan,"Zhixin Pan, Prabhat Mishra",https://doi.org/10.1145/3394885.3431595,38,23,0
76,On the Impact of Aging on Power Analysis Attacks Targeting Power-Equalized Cryptographic Circuits.,2021,ACM, Taiwan,"Md Toufiq Hasan Anik, Bijan Fadaeinia, Amir Moradi, Naghmeh Karimi",https://doi.org/10.1145/3394885.3431597,6,4,0
77,Energy-Performance Co-Management of Mixed-Sensitivity Workloads on Heterogeneous Multi-core Systems.,2021,ACM, Taiwan,"Elham Shamsa, Anil Kanduri, Amir M. Rahmani, Pasi Liljeberg",https://doi.org/10.1145/3394885.3431516,4,0,0
78,Optimizing Inter-Core Data-Propagation Delays in Industrial Embedded Systems under Partitioned Scheduling.,2021,ACM, Taiwan,"Lamija Hasanagic, Tin Vidovic, Saad Mubeen, Mohammad Ashjaei, Matthias Becker",https://doi.org/10.1145/3394885.3431515,3,0,0
79,LiteIndex: Memory-Efficient Schema-Agnostic Indexing for JSON documents in SQLite.,2021,ACM, Taiwan,"Siqi Shang, Qihong Wu, Tianyu Wang, Zili Shao",https://doi.org/10.1145/3394885.3431518,1,0,0
80,Micro-architectural Cache Side-Channel Attacks and Countermeasures.,2021,ACM, Taiwan,"Chaoqun Shen, Congcong Chen, Jiliang Zhang",https://doi.org/10.1145/3394885.3431638,7,3,0
81,Security of Neural Networks from Hardware Perspective: A Survey and Beyond.,2021,ACM, Taiwan,"Qian Xu, Md Tanvir Arafin, Gang Qu",https://doi.org/10.1145/3394885.3431639,19,0,0
82,Learning Assisted Side Channel Delay Test for Detection of Recycled ICs.,2021,ACM, Taiwan,"Ashkan Vakil, Farzad Niknia, Ali Mirzaeian, Avesta Sasan, Naghmeh Karimi",https://doi.org/10.1145/3394885.3431640,9,6,0
83,ML-augmented Methodology for Fast Thermal Side-channel Emission Analysis.,2021,ACM, Taiwan,"Norman Chang, Deqi Zhu, Lang Lin, Dinesh Selvakumaran, Jimin Wen, Stephen H. Pan, Wenbo Xia, Hua Chen, Calvin Chow, Gary Chen",https://doi.org/10.1145/3394885.3431641,2,0,0
84,1st-Order to 2nd-Order Threshold Logic Gate Transformation with an Enhanced ILP-based Identification Method.,2021,ACM, Taiwan,"Li-Cheng Zheng, Hao-Ju Chang, Yung-Chih Chen, Jing-Yang Jou",https://doi.org/10.1145/3394885.3431558,0,0,0
85,A Novel Technology Mapper for Complex Universal Gates.,2021,ACM, Taiwan,"Meng-Che Wu, Ai Quoc Dao, Mark Po-Hung Lin",https://doi.org/10.1145/3394885.3431561,0,0,0
86,High-Level Synthesis of Transactional Memory.,2021,ACM, Taiwan,"Omar Ragheb, Jason Helge Anderson",https://doi.org/10.1145/3394885.3431556,0,0,0
87,VADER: Leveraging the Natural Variation of Hardware to Enhance Adversarial Attack.,2021,ACM, Taiwan,"Hao Lv, Bing Li, Ying Wang, Cheng Liu, Lei Zhang",https://doi.org/10.1145/3394885.3431598,2,0,0
88,Entropy-Based Modeling for Estimating Adversarial Bit-flip Attack Impact on Binarized Neural Network.,2021,ACM, Taiwan,"Navid Khoshavi, Saman Sargolzaei, Yu Bi, Arman Roohi",https://doi.org/10.1145/3394885.3431594,2,1,0
89,A Low Cost Weight Obfuscation Scheme for Security Enhancement of ReRAM Based Neural Network Accelerators.,2021,ACM, Taiwan,"Yuhang Wang, Song Jin, Tao Li",https://doi.org/10.1145/3394885.3431599,3,1,0
90,Puncturing the memory wall: Joint optimization of network compression with approximate memory for ASR application.,2021,ACM, Taiwan,"Qin Li, Peiyan Dong, Zijie Yu, Changlu Liu, Fei Qiao, Yanzhi Wang, Huazhong Yang",https://doi.org/10.1145/3394885.3431512,0,0,0
91,Canonical Huffman Decoder on Fine-grain Many-core Processor Arrays.,2021,ACM, Taiwan,"Satyabrata Sarangi, Bevan Baas",https://doi.org/10.1145/3394885.3431424,5,3,0
92,A Decomposition-Based Synthesis Algorithm for Sparse Matrix-Vector Multiplication in Parallel Communication Structure.,2021,ACM, Taiwan,"Mingfei Yu, Ruitao Gao, Masahiro Fujita",https://doi.org/10.1145/3394885.3431422,1,0,0
93,Learning Boolean Circuits from Examples for Approximate Logic Synthesis.,2021,ACM, Taiwan,"Sina Boroumand, Christos-Savvas Bouganis, George A. Constantinides",https://doi.org/10.1145/3394885.3431559,5,0,0
94,Read your Circuit: Leveraging Word Embedding to Guide Logic Optimization.,2021,ACM, Taiwan,"Walter Lau Neto, Matheus Trevisan Moreira, Luca G. Amarù, Cunxi Yu, Pierre-Emmanuel Gaillardon",https://doi.org/10.1145/3394885.3431560,5,0,0
95,Exploiting HLS-Generated Multi-Version Kernels to Improve CPU-FPGA Cloud Systems.,2021,ACM, Taiwan,"Bernardo Neuhaus Lignati, Michael Guilherme Jordan, Guilherme Korol, Mateus Beck Rutzig, Antonio Carlos Schneider Beck",https://doi.org/10.1145/3394885.3431557,4,2,0
96,Area Efficient Functional Locking through Coarse Grained Runtime Reconfigurable Architectures.,2021,ACM, Taiwan,"Jianqi Chen, Benjamin Carrión Schäfer",https://doi.org/10.1145/3394885.3431601,3,3,0
97,ObfusX: Routing Obfuscation with Explanatory Analysis of a Machine Learning Attack.,2021,ACM, Taiwan,"Wei Zeng, Azadeh Davoodi, Rasit Onur Topaloglu",https://doi.org/10.1145/3394885.3431600,4,0,0
98,Breaking Analog Biasing Locking Techniques via Re-Synthesis.,2021,ACM, Taiwan,"Julian Leonhard, Mohamed Elshamy, Marie-Minerve Louërat, Haralampos-G. D. Stratigopoulos",https://doi.org/10.1145/3394885.3431603,9,2,0
99,Energy and QoS-Aware Dynamic Reliability Management of IoT Edge Computing Systems.,2021,ACM, Taiwan,"Kazim Ergun, Raid Ayoub, Pietro Mercati, Dancheng Liu, Tajana Rosing",https://doi.org/10.1145/3394885.3431612,1,0,0
100,Light: A Scalable and Efficient Wavelength-Routed Optical Networks-On-Chip Topology.,2021,ACM, Taiwan,"Zhidan Zheng, Mengchu Li, Tsun-Ming Tseng, Ulf Schlichtmann",https://doi.org/10.1145/3394885.3431613,0,0,0
101,One-pass Synthesis for Field-coupled Nanocomputing Technologies.,2021,ACM, Taiwan,"Marcel Walter, Winston Haaswijk, Robert Wille, Frank Sill Torres, Rolf Drechsler",https://doi.org/10.1145/3394885.3431607,0,3,0
102,Real-Time Mobile Acceleration of DNNs: From Computer Vision to Medical Applications.,2021,ACM, Taiwan,"Hongjia Li, Geng Yuan, Wei Niu, Yuxuan Cai, Mengshu Sun, Zhengang Li, Bin Ren, Xue Lin, Yanzhi Wang",https://doi.org/10.1145/3394885.3431627,0,0,0
103,Dynamic Neural Network to Enable Run-Time Trade-off between Accuracy and Latency.,2021,ACM, Taiwan,"Li Yang, Deliang Fan",https://doi.org/10.1145/3394885.3431628,0,0,0
104,When Machine Learning Meets Quantum Computers: A Case Study.,2021,ACM, Taiwan,"Weiwen Jiang, Jinjun Xiong, Yiyu Shi",https://doi.org/10.1145/3394885.3431629,0,0,0
105,Improving Efficiency in Neural Network Accelerator using Operands Hamming Distance Optimization.,2021,ACM, Taiwan,"Meng Li, Yilei Li, Vikas Chandra",https://doi.org/10.1145/3394885.3446242,0,2,0
106,Lightweight Run-Time Working Memory Compression for Deployment of Deep Neural Networks on Resource-Constrained MCUs.,2021,ACM, Taiwan,"Zhepeng Wang, Yawen Wu, Zhenge Jia, Yiyu Shi, Jingtong Hu",https://doi.org/10.1145/3394885.3439194,0,2,0
107,EHDSktch: A Generic Low Power Architecture for Sketching in Energy Harvesting Devices.,2021,ACM, Taiwan,"Priyanka Singla, Chandran Goodchild, Smruti R. Sarangi",https://doi.org/10.1145/3394885.3431447,0,0,0
108,Energy-Aware Design Methodology for Myocardial Infarction Detection on Low-Power Wearable Devices.,2021,ACM, Taiwan,"Mohanad Odema, Nafiul Rashid, Mohammad Abdullah Al Faruque",https://doi.org/10.1145/3394885.3431513,0,5,0
109,Power-Efficient Layer Mapping for CNNs on Integrated CPU and GPU Platforms: A Case Study.,2021,ACM, Taiwan,"Tian Wang, Kun Cao, Junlong Zhou, Gongxuan Zhang, Xiji Wang",https://doi.org/10.1145/3394885.3431423,0,0,0
110,A Write-friendly Arithmetic Coding Scheme for Achieving Energy-Efficient Non-Volatile Memory Systems.,2021,ACM, Taiwan,"Yi-Shen Chen, Chun-Feng Wu, Yuan-Hao Chang, Tei-Wei Kuo",https://doi.org/10.1145/3394885.3431511,0,1,0
111,DP-Sim: A Full-stack Simulation Infrastructure for Digital Processing In-Memory Architectures.,2021,ACM, Taiwan,"Minxuan Zhou, Mohsen Imani, Yeseong Kim, Saransh Gupta, Tajana Rosing",https://doi.org/10.1145/3394885.3431525,0,0,0
112,SAC: A Stream Aware Write Cache Scheme for Multi-Streamed Solid State Drives.,2021,ACM, Taiwan,"Bo Zhou, Chuanming Ding, Yina Lv, Chun Jason Xue, Qingfeng Zhuge, Edwin H.-M. Sha, Liang Shi",https://doi.org/10.1145/3394885.3431520,0,0,0
113,Providing Plug N' Play for Processing-in-Memory Accelerators.,2021,ACM, Taiwan,"Paulo C. Santos, Bruno E. Forlin, Luigi Carro",https://doi.org/10.1145/3394885.3431527,0,2,0
114,Aging-Aware Request Scheduling for Non-Volatile Main Memory.,2021,ACM, Taiwan,"Shihao Song, Anup Das, Onur Mutlu, Nagarajan Kandasamy",https://doi.org/10.1145/3394885.3431529,0,17,0
115,Placement for Wafer-Scale Deep Learning Accelerator.,2021,ACM, Taiwan,"Benzheng Li, Qi Du, Dingcheng Liu, Jingchong Zhang, Gengjie Chen, Hailong You",https://doi.org/10.1145/3394885.3431563,0,0,0
116,Net2: A Graph Attention Network Method Customized for Pre-Placement Net Length Estimation.,2021,ACM, Taiwan,"Zhiyao Xie, Rongjian Liang, Xiaoqing Xu, Jiang Hu, Yixiao Duan, Yiran Chen",https://doi.org/10.1145/3394885.3431562,0,0,0
117,Machine Learning-based Structural Pre-route Insertability Prediction and Improvement with Guided Backpropagation.,2021,ACM, Taiwan,"Tao-Chun Yu, Shao-Yun Fang, Hsien-Shih Chiu, Kai-Shun Hu, Chin-Hsiung Hsu, Philip Hui-Yuh Tai, Cindy Chin-Fang Shen",https://doi.org/10.1145/3394885.3431564,0,0,0
